A1: 39377 | B1: =A1+6 -> 39383 | H1: 24 weeks to go
A3: Date | B3: Name | C3: Miles | D3: Time | E3: Avg. speed (mph) | F3: Avg. HR (bpm) | G3: Calories | H3: Notes
A4: 39378.765277777777 | B4: First run | C4: 3.18 | D4: 40:27 | E4: 4.7 | F4: 141 | G4: 512 | H4: First run with GPS and new shoes. Right hamstring hurt at first like it always does but then felt fine until near the end when my feet ached. Hope new shoes are OK.
A5: 39379.714583333334 | B5: First Run from Work | C5: 2.77 | D5: 29:42 | E5: 5.6 | F5: 143 | G5: 445 | H5: Thought I would feel bad, but took it easy and it was OK. Tried not to run on outside of right foot and it was better
A6: 39381.720138888886 | B6: Run from work | C6: 2.75 | D6: 30:19 | E6: 5.4 | F6: 147 | G6: 438 | H6: Back hurt after half mile - it always does but it gets better. Started well, but then felt tired. I suppose it's been a hard first week.
A7: Weekly Total | C7: =SUM(C4:C6) -> 8.7
A9: 39384 | B9: =A9+6 -> 39390 | H9: 23 weeks to go
A11: Date | B11: Name | C11: Miles | D11: Time | E11: Avg. speed (mph) | F11: Avg. HR (bpm) | G11: Calories | H11: Notes
A12: 39384.753472222219 | B12: Run with Nick | C12: 3.13 | D12: 31:58 | E12: 5.9 | F12: 145 | G12: 503 | H12: I have been tired (and drunk) all weekend so wasn't looking forward to this. Actually felt good. Much faster than last week and, probably for the first time ever, I was stronger than Nick
A13: 39386.723611111112 | B13: Run Back from work on Halloween | C13: 5.07 | D13: 1:00:23 | E13: 5 | F13: 142 | G13: 787 | H13: Felt really good except for hamstring that hurt. Missed first 1/3 mile - forgot to start clock. Spent ages running round estate looking for Nicki and boys
A14: 39388.677083333336 | B14: Run From Work | C14: 2.76 | D14: 29:41 | E14: 5.6 | F14: 140 | G14: 448 | H14: Again felt tired - I alsways do on a Friday
A15: Weekly Total | C15: =SUM(C12:C14) -> 10.96
A17: 39391 | B17: =A17+6 -> 39397 | H17: 22 weeks to go
A19: Date | B19: Name | C19: Miles | D19: Time | E19: Avg. speed (mph) | F19: Avg. HR (bpm) | G19: Calories | H19: Notes
A20: 39391.720138888886 | B20: Normal Monday Route - without Nick | C20: 3.14 | D20: 32:14 | E20: 5.8 | F20: 140 | G20: 505 | H20: Felt good at first but then got a bit tired. Need a wee half way round - a problem
A21: 39392.751388888886 | B21: Run with Nick | C21: 3.22 | D21: 32:58 | E21: 5.9 | F21: 141 | G21: 519 | H21: Felt quite good considering I had run 3 miles yesterday
A22: Weekly Total | C22: =SUM(C19:C21) -> 6.36
A24: 39398 | B24: =A24+6 -> 39404 | H24: 21 weeks to go
A26: Date | B26: Name | C26: Miles | D26: Time | E26: Avg. speed (mph) | F26: Avg. HR (bpm) | G26: Calories | H26: Notes
A27: 39398.734722222223 | B27: Run around Thatcham | C27: 4.43 | D27: 51:25 | E27: 5.2 | F27: 132 | G27: 507 | H27: First run since 5-a-side in reading on Thursday. First run with IPod that Nick gave to me. I was slow but felt OK, nice and steady
A28: 39399.736805555556 | B28: Run around Thatcham | C28: 2.16 | D28: 24:14 | E28: 5.3 | F28: 134 | G28: 252 | H28: Felt tired all day after yesterday so I didn't want to go out but I have Poker in reading tomorrow so thought I should. felt OK. the only thing that hurts is my right foot, I'm not sure if my trainers are good for me?
A29: 39401.729166666664 | B29: Cold Run around Thatcham | C29: 3.7 | D29: 42:08 | E29: 5.3 | F29: 137 | G29: 438 | H29: My foot has been hurting. I tried to convince myself that I should rest, and that it was too cold but I went out anyway. I'm definitely not getting faster
A30: Weekly Total | C30: =SUM(C27:C29) -> 10.29
A32: 39405 | B32: =A32+6 -> 39411 | H32: 20 weeks to go
A34: Date | B34: Name | C34: Miles | D34: Time | E34: Avg. speed (mph) | F34: Avg. HR (bpm) | G34: Calories | H34: Notes
A35: 39405.706250000003 | B35: Run around every Thatcham house I've lived in | C35: 5.19 | D35: 1:00:59 | E35: 5.1 | F35: 139 | G35: 590 | H35: Heard today that I've got a place in the marathon. Pouring with rain. Foot still painful
A36: 39408.737500000003 | B36: Slow run | C36: 2.2 | D36: 24:43 | E36: 5.3 | F36: 134 | G36: 260 | H36: My legs have felt gradually worse since the 5 miles on Monday. All OK though except my right foot is killing me.
A37: Weekly Total | C37: =SUM(C35:C36) -> 7.39
A39: 39412 | B39: =A39+6 -> 39418 | H39: 19 weeks to go
A41: Date | B41: Name | C41: Miles | D41: Time | E41: Avg. speed (mph) | F41: Avg. HR (bpm) | G41: Calories | H41: Notes
A42: 39415.819444444445 | B42: Run with old trainers | C42: 3.6 | D42: 37:28 | E42: 5.8 | F42: 140 | G42: 430 | H42: I haven't been out for a while because my foot has been hurting. Decided to run with my old trainers - much better and I was flying!
A43: Weekly Total | C43: =SUM(C40:C42) -> 3.6
A45: 39419 | B45: =A45+6 -> 39425 | H45: 18 weeks to go
A47: Date | B47: Name | C47: Miles | D47: Time | E47: Avg. speed (mph) | F47: Avg. HR (bpm) | G47: Calories | H47: Notes
A48: 39419.740277777775 | B48: Run After Physio | C48: 5.23 | D48: 1:00:33 | E48: 5.2 | F48: 133 | G48: 611 | H48: Saw physio about foot - my trainers are wrong for me. She said I had amazing thighs! I ran again with my old trainers. Felt a bit sluggish - not surprising after works do in Putney and Schezuan on Saturday. But felt I could go for a long one until my neck started to hurt a lot so I headed home (thought at once stage I would have to phone Nicki to come and get me)
A49: 39422.715277777781 | B49: Run from Work | C49: 2.75 | D49: 26:19 | E49: 6.3 | F49: 151 | G49: 326 | H49: Car was getting a recall fixed so I arranged to run home from work. Felt really quick, thought I would get tired later but I didn't.
A50: Weekly Total | C50: =SUM(C47:C49) -> 7.98
A52: 39426 | B52: =A52+6 -> 39432 | H52: 17 weeks to go
A54: Date | B54: Name | C54: Miles | D54: Time | E54: Avg. speed (mph) | F54: Avg. HR (bpm) | G54: Calories | H54: Notes
A55: 39426.252083333333 | B55: Early Monday morning run | C55: 4.1 | D55: 41:22 | E55: 5.9 | F55: 138 | G55: 488 | H55: Couldn't sleep so Nicki persuaded me to get out at 6am. Felt OK, still using old trainers. Ran around Thatcham and then picked up my car from the Crickets
A56: 39427.76458333333 | B56: Run from Work | C56: 3.78 | D56: 39:49 | E56: 5.7 | F56: 138 | G56: 453 | H56: Ran a long route back from work. Got lost around Southend - I thought I knew everywhere in Thatcham?
A57: Weekly Total | C57: =SUM(C55:C56) -> 7.88
A59: 39433 | B59: =A59+6 -> 39439 | H59: 16 weeks to go
A61: Date | B61: Name | C61: Miles | D61: Time | E61: Avg. speed (mph) | F61: Avg. HR (bpm) | G61: Calories | H61: Notes
A62: 39433.756249999999 | B62: Run with Julian and Nick | C62: 4.4 | D62: 46:58 | E62: 5.6 | F62: 139 | G62: 508 | H62: Julian's first run - he was slow!! Then joined Nick and we really pushed it - felt good
A63: Weekly Total | C63: =SUM(C60:C62) -> 4.4
A65: 39440 | B65: =A65+6 -> 39446 | H65: 15 weeks to go
A67: Weekly Total | C67: =SUM(C65:C66) -> 0
A69: 39447 | B69: =A69+6 -> 39453 | H69: 14 weeks to go
A71: Date | B71: Name | C71: Miles | D71: Time | E71: Avg. speed (mph) | F71: Avg. HR (bpm) | G71: Calories | H71: Notes
A72: 39448.613194444442 | B72: First Run in New Year Run (with Pika) | C72: 2.8 | D72: 27:14 | E72: 6.2 | F72: 140 | G72: 319 | H72: First run after Finland, with new (neutral) trainers. Decided to take Pika. She was quite good until she saw saw a half-eaten kekab and nearly broke my wrist. My right foot still hurt a bit for just a few minutes.
A73: 39449.836805555555 | B73: Long Run with Julian | C73: 7.38 | D73: 1:19:24 | E73: 5.6 | F73: 143 | G73: 889 | H73: Nick is still injured after his ice skating accident. Julian wanted to go at 8pm. Felt too late but had tea first and then went out. He is much, much fitter than last time. We went round the loop twice. Longest run so far. Chatting all the way. Foot hurt a little but not bad
A74: Weekly Total | C74: =SUM(C72:C73) -> 10.18
A76: 39454 | B76: =A76+6 -> 39460 | H76: 13 weeks to go
A78: Date | B78: Name | C78: Miles | D78: Time | E78: Avg. speed (mph) | F78: Avg. HR (bpm) | G78: Calories | H78: Notes
A79: 39454.755555555559 | B79: Monday Route twice | C79: 5.67 | D79: 1:01:39 | E79: 5.5 | F79: 135 | G79: 674 | H79: Chris Hudson came with us. We probably went a bit too fast for his first run. It's encouraging to realise how fit I am compared with someone who is fit but not used to running. It's amazing (and a bit annoying) how quick Julian has caught up with me. We would have gone a bit longer but I was dying for a shit!
A80: 39455.729861111111 | B80: Run with Pika and then on my own | C80: 4.33 | D80: 46.28 | E80: 5.6 | F80: 140 | G80: 506 | H80: Did first 2.5 miles with Pika. She was good. But she did a big shit which I had to carry round in a poo bag for half a mile. I felt a bit tired (I did over 5 miles yesterday). Foot hasn't hurt for two complete runs. Maybe physio was right.
A81: Weekly Total | C81: =SUM(C78:C80) -> 10
A83: 39461 | B83: =A83+6 -> 39467 | H83: 12 weeks to go
A85: Date | B85: Name | C85: Miles | D85: Time | E85: Avg. speed (mph) | F85: Avg. HR (bpm) | G85: Calories | H85: Notes
A86: 39462.736111111109 | B86: First run for ages | C86: 3.43 | D86: 36:02 | E86: 5.7 | F86: 144 | G86: 402 | H86: I have been ill for a week now - it has badly affected my training. This was the most difficult run I have done so far. I felt really bad, thought I was going to cough my guts up at any moment. And it was absolutely teaming with rain. Anyway, I did it, and then collapsed on the sofa
A87: 39463.793055555558 | B87: Another run feeling bad | C87: 4.71 | D87: 50:22 | E87: 5.6 | F87: 138 | G87: 557 | H87: I still feel really bad but I've got to start piling on the miles. Went out with Pika for first mile. Why does she always have to shit. And why does it always have to be nowhere near a bin. There were loads of people out running tonight. Felt OK. My neck hasn't hurt for a while - maybe I'm running more freer? I probably could have gone further but had to get back to watch West Ham at Man City (3rd round FA Cup replay). We got beat!
A88: 39466.418749999997 | B88: Run back from Greenham Common | C88: 6.09 | D88: 1:06:28 | E88: 5.5 | F88: 139 | G88: 731 | H88: We all took Pika for a walk and I ran back through Newbury. Felt really tired and slow. I was overtaken by two old women as I was struggling up the hill past the garden centre (well, a slight incline then). I thought about saying something like "I always hit the wall at 20 miles"
A89: Weekly Total | C89: =SUM(C86:C88) -> 14.23
A91: 39468 | B91: =A91+6 -> 39474 | H91: 11 weeks to go
A93: Date | B93: Name | C93: Miles | D93: Time | E93: Avg. speed (mph) | F93: Avg. HR (bpm) | G93: Calories | H93: Notes
A94: 39470.745833333334 | B94: Longest run so far | C94: 8.5 | D94: 1:37:22 | E94: 5.2 | F94: 134 | G94: 999 | H94: Still not feeling completely right. Still get headaches every day. No idea what's wrong with me. But I felt OK tonight. Not bad considering I had loads to drink last night - went to Nawab with Nicki (they spilled a plate of curry down my coat). Didn't plan to go so long but felt OK. Slow though. I actually ran almost one third of a marathon - I don't know if that is encouraging or not
A95: 39471.725694444445 | B95: Run home from work | C95: 3.86 | D95: 41:31 | E95: 5.6 | F95: 134 | G95: 455 | H95: I thought I would feel really tired after yesterday's efforts but I felt OK. The only problem I have is that I need to wee after a few miles. It's a real pain. I am definitely over my illness so I can push on a bit now. The fundraising is also going well - 65 % now. People have been very generous.
A96: 39474.427083333336 | B96: Run through countryside | C96: 8.02 | D96: 1:31:52 | E96: 5.2 | F96: 138 | G96: 935 | H96: My first run in daylight so I decided to go up to Bucklebury and Cold Ash. Harts Hill was really hard, I felt really tired and very slow but I just kept going, I had to because I was miles from home!. I couldn't help noticing how I was greeted differently in Bucklebury and Cold Ash. "Hello, nice day" or "Good morning". It reduced to a nod in Ashmore Green, and then a stare with a "What the f*** are you doing" kind of look in Thatcham.
A97: Weekly Total | C97: =SUM(C94:C96) -> 20.38
A99: 39475 | B99: =A99+6 -> 39481 | H99: 10 weeks to go
A101: Date | B101: Name | C101: Miles | D101: Time | E101: Avg. speed (mph) | F101: Avg. HR (bpm) | G101: Calories | H101: Notes
A102: 39477.294444444444 | B102: Early morning run with Julian | C102: 4.14 | D102: 43:05 | E102: 5.8 | F102: 135 | G102: 498 | H102: Julian persuaded me to set out at 7am. Not nice, waking up to an alarm clock, I'm not used to that. Nice easy run, watching the sun come up.
A103: 39480.449305555558 | B103: From Snelsmore | C103: 10 | D103: 1:46:45 | E103: 5.6 | F103: 147 | G103: 1189 | H103: It's been a bad week. Nicki has been out twice and I went to see West Ham beat Liverpool so I wanted to do a big one today. We all took Pika over to Snelsmore. It was freezing cold. Got a bit lost and had to negotiate the A34 and M4 junction. Hard work, it's not getting easier. Really tricky, sliding on the ice. Caught a glimpse of my reflection in one of those mirrors people use to reverse out on to a busy road. I do look a bit stupid in this running gear. And I might stuff a sock down there next time I go out during the day. Neck was very painful (and my nipples for the first time) but furthest so far!
A104: 39481.669444444444 | B104: Guilt run with Julian and Nick | C104: 5.19 | D104: 50:59 | E104: 6.1 | F104: 152 | G104: 617 | H104: Julian was upset that I went out on my own yesterday (I did phone and email him!). So I had to go out today with him and Nick. I was, understandably, very tired and I think Julian was punishing me a bit. I went home after 5 miles and left Julian and Nick to go a bit further but I have to pleased with being able to 5 miles a day after running 10 yesterday.
A105: Weekly Total | C105: =SUM(C102:C104) -> 19.33
A107: 39482 | B107: =A107+6 -> 39488 | H107: 9 weeks to go
A109: Date | B109: Name | C109: Miles | D109: Time | E109: Avg. speed (mph) | F109: Avg. HR (bpm) | G109: Calories | H109: Notes
A110: 39484.754166666666 | B110: With Nick, Julian and Chris | C110: 8.81 | D110: 6.277777777777778E-2 | E110: 5.8 | F110: 142 | G110: 1056 | H110: Nice to run with 3 other people. Ended up with me and Julian doing quite a big run. I was telling Julian that I was pleased to have no injuries and then tripped over a kerb. Julian wanted to race the last bit, and then sped off, I couldn't keep up. He has got fit so quickly. He pisses me off frankly. But he is built like an Ethiopian
A112: Weekly Total | C112: =SUM(C110:C111) -> 8.81
A114: 39489 | B114: =A114+6 -> 39495 | H114: 8 weeks to go
A116: Update 12th April - Disaster 30 minutes after getting back from the 9 mile run, I couldn't walk. My achilles tendon was killing me. Went to Physio on Friday. He reckons I'll be out of action for at least 2 weeks. Looks like I'm out of the Reading half marathon. I am praying that I still have time for London. But achilles are difficult to heal. I can afford to miss two weeks, but not much more. Spent the weekend on crutches, I don't exactly look like someone who will run the marathon in April
A118: Weekly Total | C118: 0
A120: 39496 | B120: =A120+6 -> 39502 | H120: 7 weeks to go
A122: Date | B122: Name | C122: Miles | D122: Time | E122: Avg. speed (mph) | F122: Avg. HR (bpm) | G122: Calories | H122: Notes
A123: 39496 | B123: Run/walk up and down the lane | C123: 1 | H123: It is healing, but very slowly. I still can't walk properly, let alone run. I feel like a failure. The irony is that I got this injury because I was getting so fit. My physio suggested some sets of walking for 4 minutes and then slow jog for 1 minute. It was painful to start with but did ease up once I warmed up a bit
A125: Weekly Total | C125: 1
A127: 39503 | B127: =A127+6 -> 39509 | H127: 7 weeks to go
A129: Date | B129: Name | C129: Miles | D129: Time | E129: Avg. speed (mph) | F129: Avg. HR (bpm) | G129: Calories | H129: Notes
A130: 39508.599305555559 | B130: Walk/slow jog up and down the lane | C130: 1.99 | D130: 1.2409722222222224 | E130: 4 | F130: 117 | G130: 197 | H130: I'm getting desperate. As well the physio, I am also seeing a weird acupuncturist. She really hurt me; all she could say was that I had a lot of chi! I had 2 good days when my achilles was not hurting much, but this morning it was agony walking round Newbury. Anyway, I have to start running again so I did what the physio said  4 minutes walk, 1 minute slow jog for half an hour. And it was OK. Im hoping it wont start hurting after the exercise, but its a little bit of encouragement. I averaged 4 miles an hour, so it would take me 7 hours to do the marathon at that pace. I wonder what time they re-open the road to traffic.
A131: 39509.792361111111 | B131: Walk/slow jog | C131: 2.12 | D131: 1.3222222222222222 | E131: 4 | F131: 112 | G131: 206 | H131: I was supposed to be running in the Reading Half Marathon today. It was a really nice sunny day so that would have been a really enjoyable run. Instead, I spent the morning watching Charlie play football, limping because my achilles was hurting so much. I went out for a walk/jog in the evening for half an hour. Thatcham was like South Central LA, speeding boy racers tearing through the estate, police sirens everywhere. Like yesterday, the achilles wasn't too bad, until I stepped in a hole in the pavement, right on my bad ankle, and screamed. I'm still hoping that I'll be able to get enough miles in to limp round on the day
A133: Weekly Total | C133: =SUM(C130:C132) -> 4.11
A135: 39510 | B135: =A135+6 -> 39516 | H135: 6 weeks to go
A137: Date | B137: Name | C137: Miles | D137: Time | E137: Avg. speed (mph) | F137: Avg. HR (bpm) | G137: Calories | H137: Notes
A138: 39510.802777777775 | B138: Walk/slow jog | C138: 2.5 | D138: 1.5291666666666668 | E138: 4.1 | F138: 106 | G138: 241 | H138: It's been hurting most of the day. I phone Cancer Research and told them I was injured. They suggested deferring my place till next year, or maybe the New York Marathon in November. No joggers out tonight, I suppose everyone did the Reading Half yesterday. Again, I went very slowly, and again, it felt OK
A139: 39511.791666666664 | B139: Walk/jog around Newbury | C139: 3.24 | D139: 1.8805555555555555 | E139: 4.3 | F139: 115 | G139: 331 | H139: While Charlie was at football training. Felt OK, and I was getting confident. Then I nearly keeled over when I twisted my foot on an uneven kerb. Achilles hurting for 5 minutes afterwards. I wish this thing would go one way or the other - either get better so I can start running properly, or completely fail me so I can resign myself to defeat, and stop paying for physio, acupuncture etc.
A140: 39513.769444444442 | B140: Walk/run | C140: 2.18 | D140: 1.3166666666666667 | E140: 4.1 | F140: 114 | G140: 218 | H140: Phil Harris (physio) was trying to get me up to see a sports injury specialist for an ultrasound but he couldn't get me an appointment, and it was £109, so we decided my best bet was new trainers - with pronation support, rather than neutral. It will be my third pair! Took Pika up and down the lane for first 10 minutes, she was a nightmare (she has been badly behaved since she had her bits done - she bit through the Sky cables yesterday! I felt OK tonight, again very slow, but no pain. I was running without a limp, until I went up the slightest incline (I suppose it stretches the tendon more when you go uphill). I will be out of action for a few days because I need an eye operation tomorrow for ptosis, "very common, but usually in old people" - wtf
A141: 39516.675694444442 | B141: Argument down the lane in the rain | C141: 4.25 | D141: 2.3152777777777778 | E141: 4.6 | F141: 132 | G141: 437 | H141: Had the eye op on Friday. I'm not supposed to do any strenuous exercise for two weeks, but my running is not exactly strenuous so I think I'm OK. Took Pika up and down the lane to start with. She was bit by another dog and chased by a bloke, big argument. People are so nice and friendly. First run with new running shoes (designed for pronators) and they felt OK. Longest run for a while, in the pouring rain, I feel a bit optimistic for a change!
A142: Weekly Total | C142: =SUM(C138:C141) -> 12.17
A144: 39517 | B144: =A144+6 -> 39523 | H144: 5 weeks to go
A146: Date | B146: Name | C146: Miles | D146: Time | E146: Avg. speed (mph) | F146: Avg. HR (bpm) | G146: Calories | H146: Notes
A147: 39519.742361111108 | B147: Tired and cold run around Thatcham | C147: 4.6 | D147: 2.4750000000000001 | E147: 4.6 | F147: 123 | G147: 499 | H147: I have decided to walk/run on all my runs, as well as in the marathon itself. It feels like cheating a bit, but it's the only way for me this time round. My achilles was hurting after a mile but I walked for a bit and the pain went away. I felt tired though. I need to get the fitness back
A148: 39520.745138888888 | B148: Picked Pika up from Mum and Dad's | C148: 2.48 | D148: 1.4194444444444445 | E148: 4.4 | F148: 112 | G148: 246 | H148: Nice gentle run/walk (mainly walk!). Don't want to overdo it. My right foot started to hurt in the same place as it hurt with my first trainers (they were similar to the new ones). I might have to wear a different trainer on each foot - shame they are different colours!
A149: 39523.445833333331 | B149: A cold and very wet Sunday morning | C149: 10 | D149: 8.1400462962962966E-2 | E149: 4.8 | F149: 129 | G149: 968 | H149: The achilles has hardly hurt over the last few days. Exactly four weeks to go. Everyone advises to taper the trainging with three weeks to go, so I've got this week to get some miles in. Set off up Lawrences's lane, had to jump over the floods (good test for the achilles) and run against the freezing wind. Took it easy and felt OK. I even considered going on a bit further but I didn't want to risk it.
A151: Update 17th March My achilles was fine until about 3 hours after the last run, and then it got steadily worse until I couldn't walk at all by the time I went to bed. I thought the whole marathon was over. But I woke up and it was fine. It has hurt a bit all week though.
A153: Weekly Total | C153: =SUM(C147:C152) -> 17.08
A155: 39524 | B155: =A155+6 -> 39530 | H155: 4 weeks to go
A157: Date | B157: Name | C157: Miles | D157: Time | E157: Avg. speed (mph) | F157: Avg. HR (bpm) | G157: Calories | H157: Notes
A158: 39526.779166666667 | B158: Walk with boys and Pika | C158: 2.3 | D158: 2.6122685185185183E-2 | E158: 3.7 | F158: 103 | G158: 207 | H158: Tonight was only a walk really. First mile with the Robert (on his Heelies) and Charlie (on his bike) and Pika. Charlie said he will do a marathon when he's older. I went very slow, and not far, because it still hurts after last Sunday. I'm planning a long one this weekend.
A159: 39529.412499999999 | B159: Longest and coldest so far | C159: 16.1 | D159: 0.14835648148148148 | E159: 4.5 | F159: 134 | G159: 1691 | H159: Snow, sleet and hail. Spoke to Ged Adams (he has run 2 marathons) and he reckoned I need to do a 15/16 mile run before the big day. I really wanted to test my achilles, I would rather have it fail me on a training run than in London. It was freezing - TV said a windchill of minus 2. Went up through Cold Ash and Frilsham. The achilles was fine. I had more problems with the other foot, hurting at the top, same as before Xmas. I was wearing odd trainers, not sure if that was a good idea. Felt so good after 13.1 miles (half marathon) so I went down towards Siege Cross, which I regretted when I turned round into a strong headwind and hailstones. The achilles didn't even hurt that night, or next day. I will almost certainly be there at the start in 3 weeks time.
A161: Weekly Total | C161: =SUM(C158:C160) -> 18.4
A163: 39531 | B163: =A163+6 -> 39537 | H163: 3 weeks to go
A165: Date | B165: Name | C165: Miles | D165: Time | E165: Avg. speed (mph) | F165: Avg. HR (bpm) | G165: Calories | H165: Notes
A166: 39532.797222222223 | B166: No walking and no pain | C166: 3.86 | D166: 3.0277777777777778E-2 | E166: 5.3 | F166: 139 | G166: 439 | H166: Round Newbury while Charlie was at football training. Ran all the way, except for first 5 minutes warm up. Achilles felt really strong but I felt tired (still got Saturday's 16 miles in my legs).
A167: 27th March - My Bithday Nick and Karen bought me a DVD - Run Fat Boy Run. It's about a fat person running the marathon. Very appropriate.
A168: 39536.461805555555 | B168: Half Marathon with Julian | C168: 13.18 | D168: 0.10906250000000001 | E168: 5 | F168: 141 | G168: 1458 | H168: 2 weeks to go. Last long run, First training run without gloves, we must be getting into Spring. It was was freezing in the rain though. Julian's bald head was cold! We planned to do about 9 or 10 miles then thought we might as well do a half marathon (like you do). Felt tired, still can't imagine doing that twice! Achilles was a bit painful afterwards but I don't think I've done enough damage to keep me out of the marathon in 2 weeks time. For the next 2 weeks its short runs, rest and eating pasta, I think I'll fnd that a bit easier.
A170: Weekly Total | C170: =SUM(C166:C169) -> 17.04
A172: 39538 | B172: =A172+6 -> 39544 | H172: 2 weeks to go
A174: Date | B174: Name | C174: Miles | D174: Time | E174: Avg. speed (mph) | F174: Avg. HR (bpm) | G174: Calories | H174: Notes
A175: 39539.748611111114 | B175: First run in shorts | C175: 3.17 | D175: 2.2615740740740742E-2 | E175: 5.8 | F175: 144 | G175: 378 | H175: Warm enough to warm shorts (just). Nice easy jog round normal route. Felt really good at first but then my legs stared to feel tired (I did a half marathon 3 days ago). Right hamstring felt tight - I'll ask Nicki to massage it tonight :-)
A176: 39540.768055555556 | B176: Normal route with Nick | C176: 3.16 | D176: 2.2569444444444444E-2 | E176: 5.8 | F176: 138 | G176: 372 | H176: Not sure if I should be running on two consecutive nights. I would hate to overdo now. But it was nice and gentle. Exactly the same pace as I did yesterday so at least I am consistent (ly slow).
A178: Weekly Total | C178: =SUM(C175:C177) -> 6.33
A182: 39545 | B182: =A182+6 -> 39551 | H182: Last week
A184: Date | B184: Name | C184: Miles | D184: Time | E184: Avg. speed (mph) | F184: Avg. HR (bpm) | G184: Calories | H184: Notes
A185: 39546.76458333333 | B185: Last run before the big day | C185: 2.19 | D185: 2.4733796296296295E-2 | E185: 3.7 | F185: 107 | G185: 219 | H185: My hamstrings have been aching for the last 3 days. I have no idea why - I haven't done anything. I wanted to give my legs a bit of a stretch. This was a gentle walk round the lakes with Nicki, Robert, Charlie and Pika and then a slow jog back home. 5 days to go, just eating from now till then. I am frightened! I keep waking up in the middle of the night thinking about the marathon.
A187: Four days to go. I went out for my last training run last night. | B187: London Marathon | C187: 27.88 | D187: 0.24166666666666667 | E187: 4.8 | F187: 154 | G187: 2987 | H187: The night before was terrible, only slept for a couple of hours. I started right at the back, thought it would be better to be with the slower runners so I didn't go off too quickly. My Achilles started to hurt after a mile. I was a bit worried but it was fine after it warmed up. I took it really easy. I was overtaken by a few rhinos, Batman and Mr Tickle. I didn't see the 101 year old, perhaps he was ahead of me. I met up with Nicki, the boys, Mum, Dad and Colin at miles 11, 15 and 18. Met Vlad and Sandra just before Tower Bridge and saw Gill, George, Jodie and George at Canary Wharf. The rain was freezing. I felt great all the way to mile 14, then struggled but picked up towards the end, I even overtook Mr Tickle and a huge inflatable telephone. The most painful part was pulling the super-strong blister plasters off my nipples. I should have shaved them first! It's all over, don't ever have to do it again. Thanks to everyone who sponsored me.
A189: Weekly Total | C189: =SUM(C185:C187) -> 30.07
A191: Grand Total | C191: =SumBold(C1:C190) -> 256.69